,text,label
2874,脊椎肿瘤会引起不同的体征和症状，尤其是在肿瘤生长的过程中。肿瘤可能会影响你的脊髓或脊椎的神经根、血管或骨骼。脊椎肿瘤的体征和症状可能包括：肿瘤生长引起的肿瘤部位疼痛背痛，通常会辐射到身体的其他部位夜间更严重的背痛失去感觉或肌肉无力，尤其是手臂或腿部行走困难，有时会导致跌倒对冷、热和疼痛不太敏感肠道或膀胱功能丧失瘫痪，其可以是轻微的或严重的并且可以侵袭全身的不同区域脊柱肿瘤根据肿瘤的类型以不同的速率发展。,1054.0
2875,瘙痒、疲劳、嗜睡、黄皮肤、深色皮肤、腹部皮肤、黄色皮肤、黄色是的、不适、正在接受输血、正在接受注射,465.0
2876,酸度、溃疡、舌头、呕吐、咳嗽、胸部疼痛,412.0
2877,疼痛是拇指关节炎的第一个也是最常见的症状。当你抓住、抓住或捏住物体，或用拇指用力时，拇指根部可能会疼痛。其他体征和症状可能包括：拇指根部肿胀、僵硬和压痛捏或抓握物体时力量减弱活动范围减小拇指根部关节增大或骨质疏松,985.0
2878,我的背部和颈部一直很疼。我也咳嗽了很多，感觉很虚弱。我一直头晕，站不直。,186.0
2879,皮肤灰、发冷、关节疼痛、呕吐、疲劳、高烧、头痛、恶心、食欲不振、疼痛、背部疼痛、肌肉疼痛、红色斑点过多,275.0
2880,重症肌无力引起的肌无力随着使用受影响的肌肉而恶化。因为症状通常会随着休息而改善，肌肉无力时有发生。然而，症状往往会随着时间的推移而发展，通常在疾病发作后几年内达到最严重的程度。尽管重症肌无力会影响你自愿控制的任何肌肉，但某些肌肉群比其他肌肉群更容易受到影响。眼部肌肉在超过一半的重症肌无力患者中，他们的最初体征和症状涉及眼部问题，如：单眼皮或双眼皮下垂（上睑下垂）复视（复视），可能是水平或垂直的，当一只眼睛闭上时，面部和喉咙肌肉会得到改善或缓解，第一个症状涉及面部和喉咙肌肉，这可能是：说话不畅。你的讲话可能听起来很软，也可能是鼻音，这取决于哪些肌肉受到了影响。导致吞咽困难。你可能很容易窒息，使你难以进食、饮水或服药。在某些情况下，你试图吞咽的液体会从鼻子里流出来。影响咀嚼。用于咀嚼的肌肉可能会在用餐中途疲劳，尤其是如果你一直在吃难以咀嚼的东西，比如牛排。改变面部表情。例如，你的笑容可能看起来像咆哮。颈部和四肢肌肉重症肌无力也会导致颈部、手臂和腿部无力。你的腿虚弱会影响你走路的方式。颈部肌肉无力，很难抬起头来。,659.0
2881,瘙痒、呕吐、皮肤发黄、恶心、食欲不振、腹部疼痛、黄色,207.0
2882,我一直背痛，慢性咳嗽，四肢无力。我也一直感到迷失方向，双脚无力，脖子疼痛。,186.0
2883,疲劳、体重、手冷、脚痛、情绪波动、嗜睡、头晕、面部浮肿、眼睛肿胀、甲状腺肿大、脚痛、嗜睡、抑郁、易怒、月经异常,511.0
2884,瘙痒、呕吐、皮肤发黄、恶心、食欲不振、腹部疼痛、黄色,207.0
2885,腹股沟疝的体征和症状包括：耻骨两侧的隆起，当你直立时会变得更明显，尤其是当你咳嗽或拉伤时。隆起处有灼烧感或疼痛感腹股沟疼痛或不适，尤其是弯腰时，咳嗽或抬起腹股沟有沉重或拖拽感腹股沟无力或有压力偶尔，当突出的肠道进入阴囊时，睾丸周围会疼痛和肿胀。儿童的体征和症状新生儿和儿童的腹股沟疝是由出生时腹壁无力引起的。有时，只有当婴儿在排便过程中哭泣、咳嗽或紧张时，才能看到疝。他或她可能脾气暴躁，食欲比平时少。对于年龄较大的孩子，当孩子咳嗽、排便时拉伤或长时间站立时，疝可能会更明显。麻烦的迹象如果你无法将疝推入，疝的内容物可能会被困（嵌顿）在腹壁中。嵌顿疝可能会被绞窄，从而切断流向被困组织的血流。如果不治疗，绞窄性疝可能会危及生命。绞窄性疝的体征和症状包括：恶心、呕吐或两者兼有发烧突然疼痛迅速加剧疝突变红、变紫或变暗无法排便或通气,526.0
2886,呕吐、虚弱_of_one_body_side、感觉改变,718.0
2887,分裂情感障碍的症状可能因人而异。患有这种疾病的人会出现精神病症状，如幻觉或妄想，以及情绪障碍症状——要么是双相情感障碍型（躁狂发作，有时是抑郁发作），要么是抑郁型（抑郁发作）。尽管分裂情感障碍的发展和病程可能各不相同，但其定义特征包括主要情绪发作（抑郁或躁狂情绪）和在没有主要情绪发作时至少两周的精神病症状。分裂情感障碍的体征和症状取决于类型——双相情感障碍或抑郁型——除其他外，可能包括：妄想症——尽管有相反的证据，但仍有虚假、固定的信念幻觉，如听到声音或看到不存在的东西。沟通和言语受损，如语无伦次。怪异或不寻常的行为。抑郁症的症状，例如感到空虚、悲伤或毫无价值的躁狂情绪期，几天来能量增加，睡眠需求减少，以及不符合性格的行为职业、学术和社会功能受损个人护理管理问题，包括清洁和外表,880.0
2888,持续发烧、发冷、疲劳、咳嗽、高烧、头痛、淋巴结肿大、不适、痰、喉咙刺激、眼睛发红、窦压、流鼻涕、充血、胸闷、嗅觉丧失、肌肉酸痛,234.0
2889,瘙痒、呕吐、疲劳、体重减轻、皮肤发黄、皮肤黝黑、腹部疼痛,541.0
2890,我的指甲上有小凹痕，而且经常发炎，摸起来很嫩。我的手臂上也有轻微的皮疹。,822.0
2891,我喉咙痛得很厉害，而且一直觉得很累。我还发烧，经常肌肉酸痛。有时我全身都会抽筋,35.0
2892,寒战、疲劳、咳嗽、呼吸困难、出汗、不适、痰、胸闷、快速心率、锈蚀痰,766.0
2893,呕吐、皮肤发黄、腹部疼痛、腹部肿胀、腹部膨胀、酒精消耗史、液体过量,33.0
2894,发冷、呕吐、疲劳、体重减轻、咳嗽、高烧、呼吸困难、出汗、食欲不振、轻度发烧、黄热病、淋巴结肿大、不适、痰、胸闷、瘀血,1019.0
2895,疲劳、咳嗽、高烧、家族病史、粘液脓毒症,149.0
2896,呕吐、高烧、出汗、头痛、恶心、腹泻、肌肉酸痛,596.0
2897,牙齿脓肿的体征和症状包括：严重的、持续的、悸动的牙痛，可蔓延到你的颚骨、颈部或耳朵。冷热温度疼痛或不适。咀嚼或咬的压力疼痛或不舒服。发烧。面部、脸颊或颈部肿胀，可能导致呼吸或吞咽困难，下颌或颈部淋巴结肿大口腔中有臭味如果脓肿破裂，口腔中会突然冒出臭味和臭味，口腔中的咸味液体会缓解疼痛,996.0
2898,我的肚子很痛。我也一直在呕吐，感到非常恶心。,1026.0
2899,关节疼痛，颈部疼痛，膝盖疼痛，臀部关节疼痛，肿胀关节疼痛,700.0
2900,白癜风症状包括：皮肤颜色的斑块性丧失，通常首先出现在手、脸、身体开口周围和生殖器上。头皮、睫毛、眉毛或胡须上的头发过早变白或变灰。口鼻内部组织（粘膜）颜色的丧失。白癜风可以在任何年龄开始，但通常在30岁之前出现。根据白癜风的类型，它可能会影响：几乎所有的皮肤表面。这种类型被称为普遍性白癜风，变色几乎影响所有皮肤表面。身体的许多部位。这种最常见的类型被称为全身性白癜风，变色的斑块通常在相应的身体部位（对称地）进展相似。只有一侧或身体的一部分。这种类型被称为节段性白癜风，往往发生在较年轻的时候，进展一两年，然后停止。身体的一个或几个部位。这种类型被称为局限性（局灶性）白癜风。脸和手。这种类型被称为肢端面部白癜风，受影响的皮肤位于面部和手部，以及身体开口周围，如眼睛、鼻子和耳朵。很难预测这种疾病将如何发展。有时，不经治疗，斑块就会停止形成。在大多数情况下，色素损失会扩散并最终影响大部分皮肤。偶尔，皮肤会恢复颜色。,1060.0
2901,对于大多数假性胆碱酯酶缺乏症患者来说，在服用肌肉松弛剂琥珀酰胆碱之前，不会出现任何症状或体征。这种药物是麻醉的一部分。假性胆碱酯酶缺乏的体征和症状包括肌肉松弛或肌肉麻痹，持续时间比预期长几个小时。在那段时间里，你不能自己移动或呼吸。这种疾病患者的时间长短可能差异很大。,818.0
2902,皮肤灰、发冷、关节痛、呕吐、疲劳、高烧、头痛、恶心、食欲不振、疼痛、背痛、不适、红点过多,275.0
2903,muscle_wasting，high_fever，extra_marital_contacts,27.0
2904,我一直头疼，视力模糊，而且我吃东西后还会反酸和消化不良。,630.0
2905,寒战、疲劳、咳嗽、高热、呼吸困难、出汗、不适、痰、胸闷、快速心率、锈蚀痰,766.0
2906,如果半月板撕裂，疼痛和肿胀可能需要24小时或更长时间才能开始，尤其是在撕裂很小的情况下。你的膝盖可能会出现以下迹象和症状：爆裂感肿胀或僵硬疼痛，尤其是在扭曲或旋转膝盖时。膝盖很难完全伸直。当你试图移动时，感觉膝盖好像被锁住了,997.0
2907,呕吐、头痛、恶心、旋转、失去平衡、不稳定,0.0
2908,skin_rash，high_fever，起泡，红色ore_around_nose，黄色crust_ooze,515.0
2909,呕吐、头痛、虚弱_of_one_body_side、感觉异常,718.0
2910,瘙痒、皮肤瘙痒、结节性皮肤破裂、血栓斑块,394.0
2911,疲劳、痉挛、瘀伤、肥胖、大腿、血管、突出静脉,1047.0
2912,烧伤_排尿、膀胱_排尿、持续性疲劳,1035.0
2913,关节疼痛、呕吐、疲劳、高烧、黄皮肤、深色皮肤、恶心、食欲不振、腹部疼痛、黄色、急性肝功能衰竭、昏迷、胃出血,468.0
2914,我全身一直发痒。我也一直在呕吐，感觉很累。我的体重减轻了很多，还发了高烧。我的皮肤变黄了，尿液变黑了。我还一直腹痛。,541.0
2915,呕吐、焦虑、出汗、头痛、恶心、模糊和视觉障碍、过度发热、干涩、口齿不清、易怒、心悸,504.0
2916,疲劳、情绪波动、体重减轻、出汗、腹泻、心率加快、体重超标、肌肉无力、易怒、月经异常,502.0
2917,呕吐、呼吸困难、出汗、胸闷,447.0
2918,特纳综合征的体征和症状可能因女孩和患有该疾病的妇女而异。对于一些女孩来说，特纳综合征的存在可能并不明显，但对于其他女孩来说，一些身体特征在早期就很明显。体征和症状可能是微妙的，随着时间的推移发展缓慢，也可能是显著的，如心脏缺陷。出生前，根据产前无细胞DNA筛查（一种使用母亲血样筛查发育中婴儿某些染色体异常的方法）或产前超声，可能会怀疑特纳综合征。患有特纳综合征的婴儿的产前超声检查可能显示：颈部后部大量积液或其他异常积液（水肿）心脏异常出生时或婴儿期肾脏异常出生或婴儿期特纳综合征症状可能包括：宽或网状颈部低位耳宽胸部乳头间隔较宽口腔顶部（腭）高而窄肘部向外翻转的手臂指甲和脚趾甲狭窄并向上翻转手脚肿胀，尤其是在出生时略低于出生时的平均身高生长缓慢心脏缺陷后脑勺发际线低后仰或下颌短手指和脚趾在儿童、青少年和成年期几乎所有女孩中最常见的症状，患有特纳综合征的青少年和年轻女性是由于卵巢功能衰竭而导致的身材矮小和卵巢功能不全。卵巢发育失败可能发生在出生时，也可能在儿童、青少年或成年后逐渐发生。这些迹象和症状包括：生长迟缓儿童时期的预期时间没有生长激增成年人的身高明显低于家庭中女性成员的预期青春期未能开始预期的性变化青少年时期“停滞”的性发育月经周期提前结束不是因为怀孕对于大多数患有特纳综合征的女性来说，没有生育治疗就无法怀孕,1021.0
2919,疲劳、痉挛、瘀伤、肥胖、大腿、血管、突出静脉,1047.0
2920,瘙痒、皮肤瘙痒、皮肤破裂,394.0
2921,疲劳、情绪波动、体重减轻、烦躁不安、出汗、腹泻、心率加快、体重过大、肌肉无力、易怒、月经异常,502.0
2922,疲劳、痉挛、瘀伤、肥胖、大腿、血管、突出静脉,1047.0
2923,体重、手冷、脚痛、情绪波动、嗜睡、头晕、面部浮肿、眼睛肿胀、甲状腺肿大、脚痛、眩晕、抑郁、易怒、月经异常,511.0
2924,发冷、呕吐、发烧、出汗、头痛、恶心、腹泻、肌肉酸痛,596.0
2925,关节疼痛、呕吐、皮肤发黄、皮肤变黑、恶心、食欲不振、腹部疼痛、腹泻、轻度发烧、黄色、肌肉疼痛,464.0
2926,疲劳、咳嗽、高烧、呼吸困难、家族病史、粘液性脓毒症,149.0
2927,呕吐、疲劳、体重减轻、高脂肪、黄色皮肤、深色皮肤、腹部皮肤,541.0
2928,反社会人格障碍的症状包括反复出现：无视是非。撒谎占别人便宜。对他人不敏感或不尊重他人。利用魅力或智慧来操纵他人以获取个人利益或快乐。有一种优越感并且非常固执己见。有法律问题的，包括犯罪行为。对他人怀有敌意、咄咄逼人、暴力或威胁的。对伤害他人不感到内疚。不顾自身或他人的安全，做危险的事情。不负责任的，不履行工作或经济责任的。患有反社会人格障碍的成年人通常在15岁之前表现出行为障碍的症状。行为障碍的症状包括严重的、持续的行为问题，例如：对人和动物的攻击。破坏财产。撒谎和不诚实。盗窃严重违反规则。反社会人格障碍被认为是一种终身疾病。但对一些人来说，某些症状——尤其是破坏性和犯罪行为——可能会随着时间的推移而减少。目前尚不清楚这种减少是衰老对他们身心的影响、对反社会行为对他们生活影响的认识增强还是其他因素造成的。,60.0
2929,瘙痒、皮肤瘙痒、结节性皮肤破裂、血栓斑块,394.0
2930,呕吐、皮肤发黄、皮肤变黑、恶心、食欲不振、腹部疼痛、腹泻、轻度发烧、黄色、肌肉疼痛,464.0
2931,瘙痒、呕吐、体重减轻、高脂肪、黄皮肤、深色皮肤、腹部皮肤,541.0
2932,情绪波动、体重减轻、烦躁不安、出汗、腹泻、心率过快、体重过大、肌肉无力、易怒、月经异常,502.0
2933,有时，子宫腺肌症不会引起任何体征或症状，只会引起轻微的不适。然而，子宫腺肌症会导致：月经过多或持续出血月经期间严重痉挛或尖锐的、像刀一样的骨盆疼痛（痛经）慢性骨盆疼痛性交疼痛（性交困难）你的子宫可能会变大。虽然你可能不知道你的子宫是否更大，但你可能会注意到小腹有压痛或压力。,18.0
2934,呕吐、日晒、腹泻,402.0
2935,我腹部疼痛，经常发烧。我突然强烈地想尿尿。疼痛几乎是持续的，并且经常在夜间加重。我的小便几乎总是有臭味。我还觉得我的膀胱没有完全排空。,1035.0
2936,女性生殖系统打开弹出对话框关闭女性生殖系统女性生殖系统卵巢、输卵管、子宫、宫颈和阴道，也称为阴道管，组成了女性生殖系统。女性生殖系统打开弹出对话框女性生殖系统开放弹出对话框打开弹出对话框关闭女性生殖系统女性生殖系统卵巢、输卵管、子宫、宫颈和阴道，也称为阴道道，组成女性生殖系统。女性生殖系统女性生殖系统卵巢、输卵管、子宫、宫颈和阴道，也称为阴道管，组成了女性生殖系统。女性生殖系统女性生殖系统卵巢、输卵管、子宫、宫颈和阴道，也称为阴道管，组成了女性生殖系统。关闭关闭关闭女性生殖系统女性生殖系统卵巢、输卵管、子宫、宫颈和阴道，也称为阴道管，构成女性生殖系统。女性生殖系统卵巢、输卵管、子宫、宫颈和阴道，也称为阴道管，构成女性生殖系统。卵巢、输卵管、子宫、宫颈和阴道，也称为阴道管，构成了女性的生殖系统。当癌症首次发展时，可能不会引起任何明显的症状。当卵巢癌症症状发生时，通常归因于其他更常见的疾病。卵巢癌症的体征和症状可能包括：腹部肿胀或肿胀进食时迅速感到饱腹体重减轻骨盆不适疲劳背痛排便习惯改变，如便秘经常需要小便,706.0
2937,膀胱膨出是一大类出生缺陷中最常见的，称为膀胱-会阴膨出复合体（BEEC）。患有BEEC的儿童有以下情况之一：BEEC Epispadias。这是最不严重的BEEC，其中排出尿液的管道（尿道）没有完全发育。膀胱膨出。这种缺陷导致膀胱在体外形成。膀胱也由内而外翻转。通常，膀胱膨出会涉及泌尿道器官，以及消化和生殖系统。可能会出现腹壁、膀胱、生殖器、骨盆、大肠（直肠）最后一段和直肠末端开口（肛门）的缺陷。患有膀胱膨出的儿童也有膀胱输尿管反流。这种情况会导致尿液以错误的方式流动——从膀胱流回连接肾脏的管道（输尿管）。患有膀胱膨出的儿童也有会阴。阴沟外翻。泄殖腔外翻（kloe-A-kul EK-stroh-fee）是BEEC最严重的形式。在这种情况下，随着胎儿的发育，直肠、膀胱和生殖器不会完全分离。这些器官可能无法正确形成，骨盆也会受到影响。肾脏、脊椎和脊髓也可能受到影响。大多数泄殖腔外翻的儿童都有脊柱异常，包括脊柱裂。出生时腹部器官突出的儿童可能也有泄殖腔膨出或膀胱膨出。,114.0
2938,呕吐、皮肤发黄、腹部疼痛、腹部肿胀、腹部膨胀、酒精消耗史、液体过量,33.0
2939,婴儿携带B型链球菌的妇女所生的大多数婴儿都是健康的。但少数在分娩过程中感染B组链球菌的人可能会病情危重。在婴儿中，B组链球菌引起的疾病可能在出生后六小时内（早发），也可能在出生后数周或数月内（晚发）。体征和症状可能包括：发烧、体温低、进食困难、嗜睡、四肢无力或肌肉无力、呼吸困难、烦躁不安、癫痫发作、皮疹、黄疸成人许多成年人体内携带B组链球菌，通常在肠道、阴道、直肠、膀胱或喉咙，没有任何体征或症状。然而，在某些情况下，B组链球菌可引起尿路感染或其他更严重的感染。可能由B组链球菌引起的感染的体征和症状包括以下。尿路感染强烈、持续的小便欲望小便时有灼热感或疼痛通过频繁、少量的尿液呈红色、亮粉红色或可乐色——尿液中有血的迹象骨盆疼痛血液感染（菌血症）发烧发冷意识混乱或缺乏警觉性肺炎发烧发冷咳嗽呼吸急促呼吸或咳嗽时胸痛皮肤或软组织感染感染部位肿胀、发热或发红感染部位疼痛脓液或引流的病变骨骼或关节感染发烧发冷感染部位肿胀，发热或发红,430.0
2940,典型的鼹鼠是一个棕色的小斑点。但是痣有不同的颜色、形状和大小：颜色和质地。鼹鼠可以是棕色、棕褐色、黑色、蓝色、红色或粉红色。它们可以是光滑的、褶皱的、扁平的或凸起的。它们可能长出了毛发。形状大多数痣是椭圆形或圆形的。大小鼹鼠的直径通常小于1/4英寸（约6毫米），相当于铅笔橡皮擦的大小。出生时出现的痣（先天性痣）可能比平时更大，覆盖面部、躯干或肢体的一部分。鼹鼠可以在你身体的任何地方生长，包括头皮、腋下、指甲下、手指和脚趾之间。大多数人都有10到40颗痣。其中许多在50岁时发育成熟。鼹鼠可能会随着时间的推移而改变或消失。随着青春期和怀孕期间荷尔蒙的变化，它们可能会变得更黑、更大。眼睛、脸颊和鼻子周围的成簇棕色斑点有时被称为肉痣，但它们实际上是黑丘疹性皮肤病——一种脂溢性角化病，而不是色素形成细胞（痣）的成簇。黑丘疹性皮肤病在黑人女性中更为常见。肉痣没有患黑色素瘤的风险，但如果你认为它们是一种美容问题，它们可以治疗。不寻常的痣可能表明黑色素瘤如果痣有不规则的边界或不对称的形状，或者颜色、形状、大小或高度发生变化，那么它可能是皮肤癌症的征兆。此E指南可以帮助您记住要注意的事项：E A表示不对称形状。一半不同于另一半。B代表边界。寻找边缘不规则、有缺口或扇形的痣。C代表颜色。寻找变色、颜色多或颜色不均匀的生长物。D代表直径。在大于1/4英寸（约6毫米）的摩尔中寻找新的生长。E代表进化。注意大小、形状、颜色或高度变化的痣。鼹鼠也可能进化出新的体征和症状，如瘙痒或出血。癌性（恶性）痣的外观差别很大。有些可能会显示上面列出的所有更改。其他人可能只有一两个不寻常的特征。,643.0
2941,持续发烧、发冷、疲劳、咳嗽、高烧、头痛、淋巴结肿大、不适、痰、喉咙刺激、眼睛发红、窦压、流鼻涕、充血、胸闷、嗅觉丧失、肌肉酸痛,234.0
2942,发冷、呕吐、出汗、头痛、恶心、腹泻、肌肉酸痛,596.0
2943,背痛、虚弱、胸闷、头晕、失去平衡,186.0
2944,酸度、消化不良、头痛、视力模糊、过度疲劳、脖子僵硬、抑郁、视觉障碍,630.0
2945,skin_rash，high_fever，起泡，红色ore_around_nose，黄色crust_ooze,515.0
2946,便秘、疼痛排尿、运动、疼痛区域、血便、刺激,297.0
2947,呕吐、日晒、脱水、腹泻,402.0
2948,muscle_wasting、patches_in_throat、high_fever、extra_marital_contacts,27.0
2949,原发性运动性头痛这些头痛：通常被描述为悸动发生在剧烈运动期间或之后在大多数情况下影响头部两侧继发性运动性头疼这些头痛可能导致：与原发性锻炼性头痛症状相同呕吐意识丧失双眼颈强直原发性活动性头痛通常持续5分钟至48小时，而二次运动头痛通常至少持续一天，有时会持续几天或更长时间。,359.0
2950,疲劳、体重减轻、烦躁不安、嗜睡、血糖水平不规则、视力模糊、肥胖、超重、食欲增加、多尿,285.0
2951,呕吐、头痛、虚弱_of_one_body_side、感觉异常,718.0
2952,我发烧了，胃疼。我总是要尿尿，尿尿的时候很疼。疼痛一直存在，晚上会更严重。我的小便闻起来很难闻。,1035.0
2953,我一直感到头晕和头晕，而且我也很难保持平衡。我的头痛一直没有消失。,500.0
