,text,label
993,钙过敏症的体征和症状包括：皮肤上有巨大的紫色网状图案。深深的、非常疼痛的肿块会溃烂，形成黑褐色的开放性溃疡，无法愈合——通常发生在脂肪含量高的皮肤区域，如胃和大腿，尽管它们可以发生在任何地方。伤口无法愈合引起的感染原因钙过敏症的确切原因尚不清楚，但最近的研究表明，大多数患有这种疾病的人都有凝血因子异常。凝血因子是血液中有助于止血的物质。这些异常会导致比正常情况下更频繁地形成小血块。此外，钙过敏症患者的钙代谢也不平衡。这导致钙沉积在动脉（小动脉）的最小部分，最终导致小动脉中形成血栓。血栓会导致脂肪组织和皮肤缺氧和营养不足。,164.0
994,呕吐、呼吸困难、出汗,447.0
995,疲劳、皮肤发黄、恶心、食欲不振、黄是、家族历史,466.0
996,疲劳、情绪波动、体重减轻、烦躁不安、出汗、腹泻、心率加快、体重过大、肌肉无力、易怒、月经异常,502.0
997,便秘、疼痛排尿、运动、疼痛区域、血便、刺激,297.0
998,头痛、虚弱_of_one_body_side、可变感觉,718.0
999,瘙痒、呕吐、恶心、食欲不振、腹部疼痛、黄色,207.0
1000,发冷、呕吐、疲劳、体重减轻、咳嗽、高烧、呼吸困难、出汗、食欲不振、轻度发烧、黄热病、淋巴结肿大、不适、痰、胸闷、瘀血,1019.0
1001,关节疼痛、呕吐、皮肤发黄、皮肤变黑、恶心、食欲不振、腹部疼痛、腹泻、轻度发烧、黄色、肌肉疼痛,464.0
1002,疲劳、咳嗽、高烧、呼吸困难、家族病史、粘液性脓毒症,149.0
1003,瘙痒、皮肤瘙痒、胃部疼痛、灼热、小便、斑点,308.0
1004,颈关节、膝关节、髋关节、肿胀关节、疼痛行走,700.0
1005,疲劳、痉挛、瘀伤、肥胖、大腿、血管、突出静脉,1047.0
1006,关节疼痛、呕吐、疲劳、高烧、皮肤发黄、恶心、食欲不振、腹部疼痛、腹部发黄、急性肝功能衰竭、昏迷、胃出血,468.0
1007,布鲁氏菌病的症状可能在感染后的几天到几个月内随时出现。体征和症状与流感相似，包括：发烧、发冷、食欲不振、出汗、虚弱、疲劳、关节、肌肉和背痛、头痛、布鲁氏菌病症状可能会消失数周或数月，然后复发。有些人患有慢性布鲁氏菌病，甚至在治疗后也会出现多年的症状。长期体征和症状可能包括：疲劳反复发烧心内膜炎症（心内膜炎）关节炎症（关节炎）脊椎骨关节炎（脊柱炎）脊椎和骨盆连接处关节炎（骶髂关节炎）,152.0
1008,CAH的体征和症状各不相同，这取决于受影响的基因和酶缺乏的程度。身体功能所需的激素失衡可能意味着皮质醇过少、醛固酮过少、雄激素过多或这些失衡的组合。经典CAH经典CAH的体征和症状可能包括：CAH皮质醇不足。经典的CAH会导致身体产生数量不足的皮质醇。这可能会导致维持正常血压、血糖和能量水平的问题，并在疾病等身体压力下导致问题。肾上腺危象。患有典型CAH的人可能会受到皮质醇、醛固酮缺乏或两者兼有的严重影响。这被称为肾上腺危象，可能危及生命。非典型生殖器。女婴可能有非典型的生殖器外观，例如阴蒂增大，可能类似阴茎，阴唇部分闭合，类似阴囊。尿道和阴道可能只是一个开口，而不是两个单独的开口。子宫、输卵管和卵巢通常发育典型。男婴通常有典型的生殖器。雄激素过多。雄性激素雄性激素过多会导致男性和女性身高矮小和青春期提前。青春期的阴毛和其他迹象可能在很小的时候就出现了。严重的痤疮也可能发生。女性体内雄性激素过多可能导致面部毛发、体毛过多和声音低沉。改变了增长。随着骨龄的增长，儿童期可能会出现快速生长。最终高度可能比平均高度短。生育问题。这些可能包括月经不规律，或者根本没有月经，以及女性不育问题。生育问题有时会发生在男性身上。非经典CAH婴儿出生时通常没有非经典CAH的症状。一些非经典CAH患者从未出现症状。这种情况在婴儿常规血液筛查中没有发现，通常在儿童晚期或成年早期变得明显。皮质醇可能是唯一缺乏的激素。CAH CAH患有非经典CAH的女性在出生时可能有典型的生殖器。在以后的生活中，他们可能会经历：CAH月经不规律，或者根本没有月经，以及怀孕的问题男性特征，如面部毛发、过多的体毛和低沉的声音。在女性和男性中，非经典CAH的症状还可能包括：CAH阴毛早期出现和青春期早期的其他症状严重痤疮儿童期生长迅速，骨龄大，最终身高低于预期,240.0
1009,酸度、消化不良、头痛、视力模糊、过度疲劳、脖子僵硬、抑郁、易怒,630.0
1010,便秘、疼痛排尿、运动、疼痛区域、刺激,297.0
1011,疲劳、咳嗽、高烧、呼吸困难、出汗、不适、痰、胸闷、快速心率、锈蚀痰,766.0
1012,呕吐、日晒、脱水、腹泻,402.0
1013,双子宫通常不会引起任何症状。这种情况可能是在定期骨盆检查或影像学检查中发现的，以确定反复流产的原因。有双阴道和双子宫的女性最初可能会咨询医生，因为月经出血不是用卫生棉条止血的。在这种情况下，该妇女在一个阴道内放置了卫生棉条，但血液仍在从第二个子宫和阴道流出。何时就诊如果你插入卫生棉条后仍有月经流动，或者月经剧烈疼痛或反复流产，请寻求医疗建议。,303.0
1014,skin_rash，high_fever，起泡，红色ore_around_nose，黄色crust_ooze,515.0
1015,疲劳、痉挛、瘀伤、肥胖、大腿、血管、突出静脉,1047.0
1016,呕吐、头痛、恶心、旋转、失去平衡、不稳定,0.0
1017,呕吐、日晒、脱水、腹泻,402.0
1018,体重减轻、烦躁不安、嗜睡、血糖水平不规律、视力模糊、过度肥胖、食欲增加、多尿,285.0
1019,瘙痒、皮肤瘙痒、疲劳、嗜睡、高烧、头痛、食欲不振、淋巴结肿大、不适、红色斑点过多,193.0
1020,持续_刺痛、颤抖、发冷、流泪_是的,35.0
1021,瘙痒、皮肤瘙痒、结节性皮肤破裂、血栓斑块,394.0
1022,持续_刺痛、颤抖、发冷、流泪_是的,35.0
1023,皮肤灰、疲劳、嗜睡、高烧、头痛、食欲不振、轻度发烧、淋巴结肿大、不适、红色斑点过多,193.0
1024,便秘、疼痛排尿、运动、疼痛区域、血便、刺激,297.0
1025,皮肤瘙痒、发冷、关节疼痛、呕吐、疲劳、高烧、头痛、恶心、食欲不振、疼痛、背痛、不适、肌肉疼痛、红色斑点过多,275.0
1026,瘙痒、呕吐、疲劳、体重减轻、高烧、皮肤发黄、皮肤变黑,541.0
1027,瘙痒、疲劳、嗜睡、皮肤发黄、皮肤变黑、食欲减退、腹部疼痛、皮肤变黄、有黄、不适、接受输血、接受注射,465.0
1028,头痛、胸闷、头晕、失去平衡,501.0
1029,muscle_wasting、patches_in_throat、high_fever、extra_marital_contacts,27.0
1030,有时，骨转移不会引起任何体征和症状。当它确实发生时，骨转移的体征和症状包括：骨痛骨折尿失禁排便失禁腿部或手臂无力血液中钙含量高（高钙血症），可导致恶心、呕吐、便秘和意识模糊,125.0
1031,瘙痒、皮肤瘙痒、胃部疼痛、斑点小便,308.0
1032,过去几天我一直头疼，而且越来越严重。我的脖子也痛，视力模糊。,630.0
1033,持续发烧、发冷、疲劳、咳嗽、发烧、淋巴结肿大、不适、痰、喉咙刺激、眼睛发红、窦压、流鼻涕、充血、胸闷、嗅觉丧失、肌肉酸痛,234.0
1034,抽动——突然、短暂、间歇性的动作或声音——是抽动秽语综合征的标志性体征。它们可以从轻微到严重。严重的症状可能会严重干扰沟通、日常功能和生活质量。抽搐分为：单纯抽搐。这些突然、短暂和重复的抽搐涉及有限数量的肌肉群。复杂抽搐。这些不同的、协调的运动模式涉及几个肌肉群。抽搐也可能涉及运动（运动抽搐）或声音（发声抽搐）。运动抽搐通常在发声抽搐之前开始。但人们经历的抽搐范围是多样的。抽动秽语综合征常见的运动性抽搐简单抽搐复杂抽搐眨眼触摸或闻到物体头部抽搐重复观察到的动作肩膀耸耸肩按某种模式走眼球扫视猥亵手势鼻子抽搐弯曲或扭曲嘴巴动作跳跃抽动秽语综合征常见的动作性抽搐简单抽动复杂抽搐简单抽搐复杂抽搐简单抽搐复杂抽搐眨眼触摸或闻到物体头部抽搐重复观察到的动作肩膀耸耸肩按特定模式步进眼睛扫视淫秽手势鼻子抽搐弯曲或扭曲嘴巴动作跳跃眨眼触摸或闻到物体眼睛眨眼触摸或嗅到物体头部抽搐反复观察到动作摇头重复观察到的动作肩膀耸耸肩按某种模式走肩膀耸耸肩以某种模式走眼球扫视淫秽手势眼球扫视淫秽姿势鼻子抽搐弯曲或扭曲鼻子抽搐弯曲和扭曲嘴巴动作跳跃嘴巴动作跳跃抽动秽语综合征常见的嗓音抽搐简单抽搐复杂的抽搐咕哝重复自己的单词或短语咳嗽重复别人的单词或词组喉咙清理使用粗俗，淫秽或脏话吠叫抽动秽语综合征常见的嗓音抽搐简单抽搐复杂抽搐简单抽搐复合抽搐咕哝重复自己的单词或短语咳嗽重复他人的单词或词组喉咙清嗓子使用粗俗，淫秽或脏话吠叫咕哝重复自己的话或短语咕哝重复自己自己的词或短语咳嗽重复他人的词或词组咳嗽重复他人词或短语喉咙清理使用粗俗、淫秽或脏话喉咙清理使用低俗、淫秽或咒骂语词吠叫吠叫此外，抽搐可以：类型不同，频率和严重程度Worsen如果你生病、压力大、焦虑、疲劳或兴奋，发生在睡眠中随着时间的推移，Worsen在青少年早期发生变化，并在过渡到成年时有所改善。在运动或声音抽搐发作之前，你可能会经历一种不舒服的身体感觉（先兆冲动），如瘙痒、刺痛或紧张。抽动的表达让人松了一口气。经过巨大的努力，一些抽动秽语综合征患者可以暂时停止或抑制抽动。,998.0
1035,大多数患有病态窦房结综合征的人几乎没有症状。症状可能很轻微，也可能来来去去，这使得它们一开始很难识别。病态窦房结综合征的体征和症状可能包括：心跳加速、颤动（心悸）、胸痛或不适、眩晕或头晕、昏厥或近乎昏厥疲劳呼吸急促脉搏减慢（心动过缓）,906.0
1036,寒战、疲劳、咳嗽、高热、呼吸困难、不适、痰、胸闷、快速心率、锈蚀痰,766.0
1037,膀胱分泌物，尿液中的污垢，持续的汗液,1035.0
1038,呕吐、头痛、恶心、旋转、失去平衡、不稳定,0.0
1039,虚弱、颈痛、头晕、失去平衡,186.0
1040,关节疼痛、呕吐、疲劳、发烧、皮肤发黄、皮肤变黑、恶心、食欲不振、腹部疼痛、发黄、昏迷、胃出血,468.0
1041,我呼吸困难，尤其是在外面的时候。我开始觉得又热又出汗。我也经常得尿路感染和酵母感染。,284.0
1042,呕吐、头痛、虚弱_of_one_body_side、感觉异常,718.0
1043,在病情严重之前，三尖瓣反流通常不会引起症状或体征。当出于其他原因进行测试时，可能会发现这种情况。三尖瓣反流的体征和症状可能包括：疲劳心律失常颈部搏动呼吸急促伴有活动腹部、腿部或颈部静脉肿胀,1014.0
1044,持续发烧、发冷、疲劳、咳嗽、发烧、淋巴结肿大、不适、痰、喉咙刺激、眼睛发红、窦压、流鼻涕、充血、胸闷、嗅觉丧失、肌肉酸痛,234.0
1045,疲劳、体重、手冷、脚痛、情绪波动、嗜睡、头晕、面部浮肿、眼睛肿胀、甲状腺肿大、脚痛、嗜睡、抑郁、易怒、月经异常,511.0
1046,我发烧了，无法用鼻子或嘴巴呼吸。我累了，一直在咳出粘液。你能推荐一些药物吗？,149.0
1047,肌肉无力、关节肿胀、运动不稳定、行走疼痛,72.0
1048,skin_rash、nodal_skin_eruptions、dischromic_patches,394.0
1049,skin_rash，high_fever，起泡，红色ore_around_nose，黄色crust_ooze,515.0
1050,儿童言语失用症（CAS）儿童可能有许多言语症状或特征，这些症状或特征因其年龄和言语问题的严重程度而异。CAS可能与：CAS首词出现延迟口语单词数量有限仅形成少数辅音或元音的能力这些症状通常在18个月至2岁之间出现，可能表明疑似CAS。CAS由于儿童通常在2至4岁之间产生更多的言语，可能表明CAS的特征包括：CAS元音和辅音失真单词中或单词之间的音节分离发音错误，如“pie”听起来像“bye”许多CAS儿童很难让他们的下巴、嘴唇和舌头处于正确的位置发出声音，并且它们可能难以平稳地移动到下一个声音。CAS许多CAS儿童也有语言问题，如词汇减少或语序困难。CAS有些症状可能是CAS儿童特有的，有助于诊断问题。然而，CAS的一些症状也是其他类型的言语或语言障碍的症状。如果儿童只有CAS和其他类型的言语或语言障碍的症状，则很难诊断CAS。CAS CAS CAS CAS某些特征，有时称为标记物，有助于将CAS与其他类型的言语障碍区分开来。与CAS相关的特殊情况包括：CAS CAS难以从一个声音、音节或单词平稳地移动到另一个声音或单词。用下巴、嘴唇或舌头Groping运动来做出正确的发音元音变形，例如试图使用正确的元音，但说得不正确在单词中使用错误的重音，例如将“香蕉”发音为“BUH-nan-uh”代替“buh NAN uh”在所有音节上使用同等的重音，例如说“buh-NAN-uh”音节分离，例如在音节之间停顿或间隔不一致，例如在尝试第二次说同一个单词时犯不同的错误模仿简单单词的困难不一致的发音错误，如说“down”而不是“town”其他特征出现在大多数有言语或语言问题的儿童身上，对区分CAS没有帮助。CAS儿童和其他类型的言语或语言障碍儿童的特征包括：CAS CAS在7至12个月大之间发出较少或较少的声音说话较晚（12至18个月大之后）使用有限数量的辅音和元音经常遗漏（省略）声音使用难以理解的语音其他语音障碍有时与CAS混淆一些语音障碍通常与CAS混淆，因为某些特征可能重叠。这些语音障碍包括发音障碍、语音障碍和构音障碍。CAS儿童在学习如何发出特定声音方面有困难，但在规划或协调说话动作方面没有困难，可能患有发音或语音障碍。发音和语音障碍比CAS更常见。CAS发音或语音语音错误可能包括：替换发音，如说“fum”而不是“thumb”，说“wabbit”而不是”rabbit“或说“tup”而不是（cup）去掉（省略）词尾辅音，如说”duh“而不是”duck“或”uh“而不是“up”停止气流，如说‘tun’而不是”sun“或”doo“而不是zoo”简化声音组合，如用“ting”代替“string”或用“fog”代替“frog”。构音障碍是一种运动性言语障碍，由虚弱、痉挛或无法控制言语肌肉引起。发出语音很困难，因为语音肌肉不能像正常人那样移动得那么远、那么快或那么有力。患有构音障碍的人也可能声音嘶哑、柔和甚至紧绷，或口齿不清或语速缓慢。构音障碍通常比CAS更容易识别。然而，当构音障碍是由大脑某些影响协调的区域受损引起的时，很难确定CAS和构音障碍之间的差异。,197.0
1051,呕吐、日晒、脱水、腹泻,402.0
1052,呕吐、消化不良、食欲不振、腹部疼痛、气体排出、内脏痉挛,735.0
1053,从感染汉坦病毒到发病的时间通常约为2至3周。汉坦病毒肺综合征的发展经历了两个不同的阶段。在可能持续数天的第一阶段，最常见的体征和症状是：发烧和发冷肌肉疼痛或头痛有些人还会经历：恶心胃痛呕吐腹泻随着疾病的发展，它会导致肺组织受损、肺部积液，以及肺和心功能的严重问题。体征和症状可能包括：咳嗽呼吸困难低血压心率不规则,441.0
1054,瘙痒、皮肤灰、灼烧、小便、斑点、小便,308.0
1055,持续发烧、发冷、疲劳、咳嗽、高烧、头痛、淋巴结肿大、不适、痰、喉咙刺激、眼睛发红、窦压、流鼻涕、充血、胸闷、嗅觉丧失、肌肉酸痛,234.0
1056,大多数甲状腺肿患者除了颈部底部肿胀外，没有任何体征或症状。在许多情况下，甲状腺肿很小，只有在常规医学检查或其他疾病的影像学检查中才发现。其他体征或症状取决于甲状腺功能是否改变、甲状腺肿生长的速度以及是否阻碍呼吸。甲状腺功能减退甲状腺功能减退的体征和症状包括：疲劳对寒冷的敏感性增加嗜睡皮肤干燥便秘肌肉无力记忆或注意力问题甲状腺功能亢进甲状腺功能亢进的症状和体征包括：体重减轻心跳过快对热量的敏感性增加出汗过多震颤刺激性和紧张性肌肉无力频繁排便月经模式的变化睡眠困难高血压食欲增加患有甲状腺功能亢进的儿童也可能有以下症状：身高快速增长行为变化骨骼生长超过儿童年龄的预期生长阻塞性甲状腺肿甲状腺肿的大小或位置可能会阻塞气道和音箱。体征和症状可能包括：吞咽困难用力呼吸困难咳嗽呕吐打鼾,421.0
1057,疲劳、皮肤发黄、恶心、食欲不振、黄是、家族历史,466.0
1058,持续发烧、发冷、疲劳、咳嗽、高烧、头痛、淋巴结肿大、不适、痰、喉咙刺激、眼睛发红、窦压、流鼻涕、充血、胸闷、嗅觉丧失、肌肉酸痛,234.0
1059,关节，颈部，膝盖，臀部，肿胀关节,700.0
1060,发冷、呕吐、体重减轻、咳嗽、高烧、呼吸困难、出汗、食欲不振、轻度发烧、黄色发热、淋巴结肿大、不适、痰、胸闷、瘀血,1019.0
1061,2型糖尿病的症状通常发展缓慢。事实上，你可能患有2型糖尿病多年而不知道。当症状出现时，可能包括：口渴加剧。尿频。饥饿加剧。意外的体重减轻。疲劳视力模糊。溃疡愈合缓慢。频繁感染。手脚麻木或刺痛。皮肤变黑的区域，通常在腋下和颈部。,1024.0
1062,疲劳、皮肤发黄、恶心、食欲不振、家庭病史,466.0
1063,妊娠期妊娠纹打开弹出对话框关闭妊娠期妊娠痕妊娠期妊娠妊娠纹在妊娠期很常见，尤其是在妊娠晚期。它们经常褪色，但通常不会消失。妊娠期妊娠纹打开弹出对话框妊娠期妊娠痕打开弹出对话框打开弹出对话框关闭妊娠期妊娠妊娠纹妊娠期妊娠期妊娠缝很常见，尤其是在妊娠晚期。它们经常褪色，但通常不会消失。妊娠期妊娠期妊娠纹妊娠期妊娠痕在妊娠期很常见，尤其是在孕晚期。它们经常褪色，但通常不会消失。妊娠期妊娠期妊娠纹妊娠期妊娠痕在妊娠期很常见，尤其是在孕晚期。它们经常褪色，但通常不会消失。妊娠期妊娠期妊娠纹妊娠期妊娠痕在妊娠期很常见，尤其是在最后三个月。它们经常褪色，但通常不会消失。妊娠期妊娠纹妊娠期妊娠痕很常见，尤其是在孕晚期。它们经常褪色，但通常不会消失。妊娠纹在妊娠期很常见，尤其是在最后三个月。它们经常褪色，但通常不会消失。广泛的妊娠纹打开弹出对话框关闭广泛的妊娠印广泛的妊娠痕可以覆盖身体的大面积，但这种情况很少发生。这可能是由于使用皮质类固醇药物或库欣综合征等疾病造成的。加宽的妊娠纹打开弹出对话框加宽的妊娠痕打开弹出对话框打开弹出对话框关闭加宽的妊娠标记加宽的妊娠痕迹可以覆盖身体的大面积，但这种情况很少发生。这可能是由于使用皮质类固醇药物或库欣综合征等疾病造成的。闭合广泛妊娠纹广泛妊娠纹可以覆盖身体的大面积，但很少发生。这可能是由于使用皮质类固醇药物或库欣综合征等疾病造成的。闭合广泛妊娠纹广泛妊娠纹可以覆盖身体的大面积，但很少发生。这可能是由于使用皮质类固醇药物或库欣综合征等疾病造成的。闭合闭合广泛妊娠纹广泛妊娠纹可以覆盖身体的大面积，但这种情况很少发生。这可能是由于使用皮质类固醇药物或库欣综合征等疾病造成的。广泛的妊娠纹妊娠纹可以覆盖身体的大面积，但很少发生。这可能是由于使用皮质类固醇药物或库欣综合征等疾病造成的。妊娠纹可以覆盖身体的大部分区域，但很少发生。这可能是由于使用皮质类固醇药物或库欣综合征等疾病造成的。妊娠纹看起来并不都一样。它们的变化取决于你患它们的时间、原因、它们在你身上的位置以及你的皮肤类型。常见的变化包括：腹部、胸部、臀部、臀部或身体其他部位的凹陷条纹或线条粉红色、红色、褪色、黑色、蓝色或紫色条纹褪色为浅色的明亮条纹覆盖身体大片区域,947.0
1064,skin_rash，high_fever，起泡，红色ore_around_nose，黄色crust_ooze,515.0
1065,我的皮肤上有这些又红又颠簸的斑点，很痒。它们的颜色也与我的其他皮肤不同。我有一些肿块，有点像小肿块。,394.0
1066,酸度、消化不良、头痛、视力模糊、过度疲劳、脖子僵硬、抑郁、易怒、视觉障碍,630.0
1067,头痛、胸闷、头晕、失去平衡、注意力不集中,501.0
1068,神经细胞（神经元）打开弹出对话框关闭神经细胞。每一个神经细胞都由细胞体组成，细胞体包括细胞核、一个主要的分支纤维（轴突）和许多较小的分枝纤维（树突）。髓鞘是覆盖、隔离和保护大脑和脊髓神经的脂肪物质。神经细胞（神经元）打开弹出对话框神经细胞。每一个神经细胞都由细胞体组成，细胞体包括细胞核、一个主要的分支纤维（轴突）和许多较小的分枝纤维（树突）。髓鞘是覆盖、隔离和保护大脑和脊髓神经的脂肪物质。闭合神经细胞神经细胞神经系统中通讯的基本单位是神经细胞。每一个神经细胞都由细胞体组成，细胞体包括细胞核、一个主要的分支纤维（轴突）和许多较小的分枝纤维（树突）。髓鞘是覆盖、隔离和保护大脑和脊髓神经的脂肪物质。闭合神经细胞神经细胞神经系统中通讯的基本单位是神经细胞。每一个神经细胞都由细胞体组成，细胞体包括细胞核、一个主要的分支纤维（轴突）和许多较小的分枝纤维（树突）。髓鞘是覆盖、隔离和保护大脑和脊髓神经的脂肪物质。闭合闭合闭合神经细胞神经细胞神经系统中通信的基本单位是神经细胞。每一个神经细胞都由细胞体组成，细胞体包括细胞核、一个主要的分支纤维（轴突）和许多较小的分枝纤维（树突）。髓鞘是覆盖、隔离和保护大脑和脊髓神经的脂肪物质。神经细胞神经系统中通讯的基本单位是神经细胞。每一个神经细胞都由细胞体组成，细胞体包括细胞核、一个主要的分支纤维（轴突）和许多较小的分枝纤维（树突）。髓鞘是覆盖、隔离和保护大脑和脊髓神经的脂肪物质。神经系统中通信的基本单位是神经细胞（神经元）。每一个神经细胞都由细胞体组成，细胞体包括细胞核、一个主要的分支纤维（轴突）和许多较小的分枝纤维（树突）。髓鞘是覆盖、隔离和保护大脑和脊髓神经的脂肪物质。大多数感染脊髓灰质炎病毒的人都没有症状。流产性脊髓灰质炎大约5%的脊髓灰质炎病毒感染者会患上一种名为流产性脊髓灰质炎的轻度疾病。这会导致持续2到3天的流感样症状。其中包括：发烧头痛肌肉疼痛喉咙痛胃痛食欲不振恶心呕吐非麻痹性脊髓灰质炎一种更严重的疾病，称为非麻痹性小儿麻痹症，影响约1%的感染者。虽然这种疾病持续时间超过几天，但不会导致瘫痪。除了有更严重的流感样症状外，非缓解性脊髓灰质炎症状可能包括：颈部疼痛或僵硬手臂或腿部疼痛或僵硬严重头痛可能会出现第二阶段症状，或者一个人在第二阶段开始前几天似乎有所好转。这些症状包括：脊椎和颈部僵硬反射减弱肌肉无力麻痹性脊髓灰质炎这种最严重的疾病很罕见。这种疾病的开始很像非传播性脊髓灰质炎。但它会发展为更严重的体征和症状，包括：剧烈疼痛对触摸刺痛或刺痛感极为敏感肌肉痉挛或抽搐肌肉无力发展为跛行麻痹任何肢体组合都可能出现瘫痪。但最常见的是一条腿瘫痪，其次是一只手臂瘫痪。根据疾病的严重程度，其他体征或症状可能包括：呼吸肌麻痹吞咽困难脊髓灰质炎后综合征脊髓灰质炎后综合症是新体征或症状的出现或问题的进展。这种情况通常发生在患小儿麻痹症几十年后。常见的体征和症状包括：进行性肌肉或关节无力和疼痛疲劳肌肉萎缩呼吸或吞咽问题睡眠相关的呼吸障碍，如睡眠呼吸暂停对低温的耐受性降低,770.0
