,text,label
1986,在失去亲人后的最初几个月里，正常悲伤的许多迹象和症状与复杂悲伤的迹象和症状相同。然而，当正常的悲伤症状随着时间的推移逐渐开始消退时，复杂的悲伤症状会持续或恶化。复杂的悲伤就像处于一种持续的、高度的哀悼状态，使你无法治愈。复杂悲伤的体征和症状可能包括：强烈的悲伤，对失去爱人的痛苦和沉思除了爱人的死，几乎不关注其他事情极端关注对爱人的提醒或过度回避提醒对死者的强烈而持久的渴望或思念接受死亡的问题麻木或超然对失去亲人的痛苦感觉生活没有意义或目的对他人缺乏信任无能享受生活或回想与爱人的积极经历如果你继续这样做，也可能会表现出复杂的悲伤：难以执行正常的日常生活与他人隔离并退出社交活动经历抑郁、深深的悲伤，内疚或自责相信你做错了什么，或者本可以阻止死亡。没有你所爱的人，生活就不值得了。希望你和你所爱之人一起死去,238.0
1987,与yips相关的最常见症状是不自主的肌肉抽搐，尽管有些人会出现震颤、抽搐、痉挛或冻僵。原因在一些人中，yips是一种局灶性肌张力障碍，这是一种在特定任务中导致肌肉不自主收缩的情况。这很可能和过度使用某些肌肉有关，类似于作家的抽筋。焦虑会使效果恶化。一些运动员变得如此焦虑和自我专注——过度思考以至于分心——以至于他们执行一项技能（如推杆）的能力受损。“窒息”是一种极端的表现焦虑，可能会影响高尔夫球手或任何运动员的比赛。风险因素yips往往与以下因素有关：年龄较大有更多打高尔夫球的经验梅奥诊所工作人员梅奥诊所人员要求预约诊断和治疗诊断和治疗2022年3月23日打印分享在：Facebook推特Facebook推特显示参考Conidi F.一些不寻常的运动相关神经系统疾病。连续体2014;20:1645. Dhungana S等。高尔夫球手的Yips和其他运动障碍。运动障碍。2013;28:576. Berstein CJ等。成人原发性肌张力障碍患者的行为干预：一项系统综述。BMC神经病学。2016;16:1. https://bmcneurol.biomedcentral.com/articles/10.1186/s12883-016-0562-y.访问时间：2018年2月2日。显示参考文献Conidi F.一些不寻常的运动相关神经系统疾病。连续体2014;20:1645. Dhungana S等。高尔夫球手的Yips和其他运动障碍。运动障碍。2013;28:576. Berstein CJ等。成人原发性肌张力障碍患者的行为干预：一项系统综述。BMC神经病学。2016;16:1. https://bmcneurol.biomedcentral.com/articles/10.1186/s12883-016-0562-y.访问时间：2018年2月2日。Conidi F.一些不寻常的运动相关神经系统疾病。连续体2014;20:1645. Dhungana S等。高尔夫球手的Yips和其他运动障碍。运动障碍。2013;28:576. Berstein CJ等。成人原发性肌张力障碍患者的行为干预：一项系统综述。BMC神经病学。2016;16:1. https://bmcneurol.biomedcentral.com/articles/10.1186/s12883-016-0562-y.访问时间：2018年2月2日。Conidi F.一些不寻常的运动相关神经系统疾病。连续体2014;20:1645. Dhungana S等。高尔夫球手的Yips和其他运动障碍。运动障碍。2013;28:576. Berstein CJ等。成人原发性肌张力障碍患者的行为干预：一项系统综述。BMC神经病学。2016;16:1. https://bmcneurol.biomedcentral.com/articles/10.1186/s12883-016-0562-y.访问时间：2018年2月2日。相关产品和服务书籍：Mayo Clinic家庭健康书籍，第5版时事通讯：Mayo诊所健康信-数字版展示Mayo诊所的更多产品和服务相关产品与服务书籍：梅奥诊所家庭健康书，第5版本时事通讯；Mayo诊所健康信-数字版本展示Mayo Clinical产品与服务更多产品与服务书：Mayo门诊家庭健康书籍第5版通讯：Mayo临床健康信-数码版展示MayoClinic Yips症状与原因诊断与治疗Yips症状和原因诊断与治疗,1079.0
1988,持续_发冷、发冷、浇水_是的,35.0
1989,瘙痒、呕吐、皮肤发黄、恶心、食欲不振、腹部疼痛、黄色,207.0
1990,皮肤瘙痒、发冷、关节疼痛、呕吐、疲劳、高烧、头痛、恶心、食欲不振、疼痛、背痛、不适、肌肉疼痛、红色斑点过多,275.0
1991,与腹泻（稀便、水样便）相关的体征和症状可能包括：腹部痉挛或疼痛肿胀恶心呕吐热粪便中有血迹粪便中有粘液急需排便,294.0
1992,关节疼痛、呕吐、皮肤发黄、皮肤黝黑、食欲不振、腹部疼痛、腹泻、轻度发烧、黄色、肌肉疼痛,464.0
1993,关节疼痛、呕吐、疲劳、皮肤发黄、皮肤黝黑、恶心、食欲不振、腹部疼痛、黄色,467.0
1994,我最近感觉很不舒服。我发烧、发冷、咳嗽，呼吸困难。我也出了很多汗，感觉非常虚弱和疲惫。我也有一些粘稠的红色痰。,766.0
1995,疲劳、咳嗽、高烧、呼吸困难、家族病史、粘液性脓毒症,149.0
1996,持续_刺痛、颤抖、发冷、流泪_是的,35.0
1997,头痛、胸闷、头晕、失去平衡、注意力不集中,501.0
1998,因为癫痫是由大脑的异常活动引起的，癫痫发作会影响大脑协调的任何过程。癫痫发作的体征和症状可能包括：暂时性困惑凝视性咒语肌肉僵硬手臂和腿部无法控制的抽搐失去意识或意识恐惧、焦虑或似曾相识等心理症状症状因癫痫发作类型而异。在大多数情况下，癫痫患者每次都会出现相同类型的癫痫发作，因此每次发作的症状都会相似。医生通常根据异常大脑活动的开始方式和地点，将癫痫分为局灶性发作或全身性发作。局灶性癫痫发作当癫痫发作似乎是由大脑某一区域的异常活动引起时，称为局灶性发作。这些癫痫发作分为两类：无意识的局灶性癫痫发作。曾经被称为简单的部分性癫痫发作，这些癫痫发作不会导致意识丧失。它们可能会改变情绪或改变事物的外观、气味、感觉、味道或声音。有些人会有似曾相识的感觉。这种类型的癫痫发作也可能导致身体某个部位（如手臂或腿）不自主地抽搐，以及自发的感觉症状，如刺痛、头晕和闪光。意识受损的局灶性癫痫发作。这些癫痫发作一度被称为复杂的部分性发作，涉及意识或意识的改变或丧失。这种类型的癫痫发作可能看起来像是在做梦。在意识受损的局灶性癫痫发作期间，你可能会凝视空间，对周围环境没有正常反应，或进行重复动作，如搓手、咀嚼、吞咽或绕圈行走。局灶性癫痫的症状可能与其他神经系统疾病混淆，如偏头痛、嗜睡症或精神疾病。需要进行彻底的检查和测试，将癫痫与其他疾病区分开来。全身性癫痫发作似乎涉及大脑所有区域的癫痫发作被称为全身性癫痫。存在六种类型的全身性癫痫。失神发作。失神性癫痫，以前称为小发作，通常发生在儿童身上。它们的特点是凝视太空，有或没有眨眼或拍嘴唇等微妙的身体动作，只持续5-10秒。这些癫痫发作可能会集群发生，每天发生100次，并导致短暂的意识丧失。强直性癫痫发作。强直性癫痫会导致肌肉僵硬，并可能影响意识。这些癫痫发作通常会影响背部、手臂和腿部的肌肉，并可能导致你摔倒在地。Atonic癫痫发作。阿托性癫痫，也称为下降性癫痫，会导致肌肉失去控制。由于这种情况最常影响腿部，通常会导致你突然倒下。克隆性癫痫发作。克隆性癫痫发作与重复或有节奏的肌肉抽搐有关。这些癫痫发作通常影响颈部、面部和手臂。肌阵挛发作。肌阵挛发作通常表现为突然的短暂抽搐或抽搐，通常影响上半身、手臂和腿部。强直阵挛发作。强直阵挛发作，以前称为大发作，是癫痫发作中最引人注目的类型。它们会导致意识突然丧失，身体僵硬、抽搐和颤抖。它们有时会导致膀胱失去控制或咬到你的舌头。,350.0
1999,关节疼痛、呕吐、疲劳、皮肤发黄、皮肤黝黑、恶心、食欲不振、腹部疼痛、黄色,467.0
2000,除了身材矮小之外，各种疾病的体征和症状差异很大。不成比例的侏儒症大多数侏儒症患者都有导致身材矮小的疾病。通常，这意味着一个人的躯干大小一般，四肢很短，但有些人的躯干可能很短，四肢缩短（但过大）。在这些疾病中，头部比身体大得不成比例。几乎所有患有不成比例的侏儒症的人都有正常的智力。罕见的例外情况通常是次要因素造成的，如大脑周围液体过多（脑积水）。侏儒症最常见的原因是一种叫做软骨发育不全的疾病，这种疾病会导致身材过矮。这种疾病通常会导致以下结果：平均大小的躯干短胳膊和腿，上臂和大腿特别短短手指短，中指和无名指之间通常有很宽的间隔肘部活动受限头部过大，前额突出，鼻梁扁平长腿弯曲长腿下背部摆动长腿成年人身高约4英尺（122厘米）另一种导致不成比例的侏儒症的原因是一种罕见的先天性脊椎骨骺发育不良（SEDC）。症状可能包括：躯干很短脖子短胳膊和腿缩短手脚平均尺寸宽阔、圆形胸部颧骨略平口腔顶部开口（腭裂）导致股骨向内弯曲的髋关节畸形脚部扭曲或变形颈部骨骼不稳定上脊柱逐渐驼背弯曲下背部逐渐发展出现视觉和听力问题关节炎和关节运动问题成人身高从3英尺（91厘米）到4英尺（122厘米）不等比例侏儒症比例侏儒症是由出生时或儿童早期出现的限制整体生长和发育的医疗条件引起的。因此，头部、躯干和四肢都很小，但它们彼此成比例。由于这些疾病会影响整体生长，其中许多会导致一个或多个身体系统发育不良。生长激素缺乏是造成相称性侏儒症的一个相对常见的原因。当垂体不能产生足够的生长激素时，就会发生这种情况，而生长激素对儿童的正常生长至关重要。症状包括：身高低于标准儿科生长图上的第三个百分位增长率低于年龄预期青少年时期性发育迟缓或无性发育,319.0
2001,瘙痒、呕吐、皮肤发黄、恶心、食欲不振、腹部疼痛、黄色,207.0
2002,持续_刺痛、颤抖、发冷、流泪_是的,35.0
2003,从感染到出现体征和症状的平均时间（潜伏期）为10天。潜伏期从3天到21天不等。最常见的破伤风类型被称为全身性破伤风。体征和症状逐渐开始，然后在两周内逐渐恶化。它们通常从下颌开始，在身体上向下发展。全身性破伤风的体征和症状包括：疼痛的肌肉痉挛和下巴僵硬、不可移动的肌肉（肌肉僵硬）嘴唇周围的肌肉紧张，有时会产生持续的咧嘴笑颈部肌肉疼痛的痉挛和僵硬吞咽困难僵硬的腹部肌肉破伤风的发展会导致反复疼痛，持续数分钟的癫痫样痉挛（全身性痉挛）。通常，脖子和背部拱起，腿变得僵硬，手臂向上拉到身体，握紧拳头。颈部和腹部的肌肉僵硬可能会导致呼吸困难。这些严重的痉挛可能是由刺激感官的小事件引发的——响亮的声音、身体的触摸、气流或光线。随着疾病的发展，其他体征和症状可能包括：高血压低血压快速心率发热极度出汗局部破伤风这种罕见的破伤风会导致伤口附近的肌肉痉挛。虽然它通常是一种不那么严重的疾病，但它可以发展为全身性破伤风。头部破伤风这种罕见的破伤风是由头部伤口引起的。它会导致面部肌肉衰弱和下巴肌肉痉挛。它也可以发展为全身性破伤风。,977.0
2004,发冷、呕吐、疲劳、高烧、头痛、恶心、便秘、腹部疼痛、腹泻、中毒症状（伤寒）,1026.0
2005,呕吐、日晒、脱水、腹泻,402.0
2006,肌肉无力、关节肿胀、运动不稳定、行走疼痛,72.0
2007,呕吐、皮肤发黄、肿胀、腹部肿胀、酒精消耗史、液体过量,33.0
2008,便秘、疼痛排尿、运动、疼痛区域、血便、刺激,297.0
2009,瘙痒、皮肤瘙痒、胃部疼痛、灼热、小便、斑点,308.0
2010,关节疼痛、呕吐、皮肤发黄、皮肤变黑、恶心、食欲不振、腹部疼痛、腹泻、轻度发烧、黄色、肌肉疼痛,464.0
2011,关节疼痛、皮肤发黄、皮肤黝黑、恶心、食欲不振、腹部疼痛、腹泻、轻度发烧、黄色、肌肉疼痛,464.0
2012,脂溢性皮炎的体征和症状可能包括：头皮、头发、眉毛、胡子或小胡子上的片状皮肤（头皮屑）头皮、面部、鼻子两侧、眉毛、耳朵、眼睑、胸部、腋下的大片油腻皮肤上覆盖着片状的白色或黄色鳞片或硬皮，腹股沟区域或乳房下方皮疹，棕色或黑色皮肤的人可能看起来更黑或更浅，白色皮肤的人看起来更红环状皮疹，是一种称为花瓣状脂溢性皮炎瘙痒（瘙痒症）的类型脂溢性皮肤炎的体征和症状往往会随着压力、疲劳或季节的变化而发作。,891.0
2013,关节疼痛、呕吐、皮肤发黄、皮肤变黑、恶心、食欲不振、腹部疼痛、腹泻、轻度发烧、黄色、肌肉疼痛,464.0
2014,疲劳、情绪波动、烦躁不安、出汗、腹泻、心跳过快、体重过大、肌肉无力、易怒、月经异常,502.0
2015,持续发烧、发冷、疲劳、咳嗽、高烧、头痛、淋巴结肿大、不适、痰、喉咙刺激、眼睛发红、窦压、流鼻涕、充血、胸闷、嗅觉丧失、肌肉酸痛,234.0
2016,背痛、虚弱、胸闷、头晕、失去平衡,186.0
2017,呕吐、头痛、恶心、旋转、失去平衡、不稳定,0.0
2018,skin_rash、joint_pin、skin_peeling、silver_like_dusting、small_dents_in_nails,822.0
2019,瘙痒、呕吐、疲劳、体重减轻、高疲劳、黄皮肤、深色皮肤、腹部疼痛,541.0
2020,瘙痒、皮肤瘙痒、疲劳、嗜睡、高烧、头痛、食欲不振、轻度发烧、淋巴结肿大、不适、红色斑点过多,193.0
2021,关节疼痛、呕吐、疲劳、高烧、黄皮肤、深色皮肤、恶心、食欲不振、腹部疼痛、黄色、急性肝功能衰竭、昏迷、胃出血,468.0
2022,呕吐、疲劳、焦虑、出汗、头痛、恶心、模糊和视觉障碍、过度发热、干涩和抽搐、口齿不清、易怒、心悸,504.0
2023,假性神经母细胞瘤症状包括：嗅觉丧失经常流鼻血通过鼻子呼吸困难随着癌症的发展，癌症可能会导致眼睛疼痛、视力丧失、耳朵疼痛和头痛。,357.0
2024,我一直觉得很不舒服。我一直在呕吐，发烧，浑身发痒。我的皮肤变黄了，尿液变黑了。我还一直腹痛。,541.0
2025,手腕疼痛可能因原因而异。例如，骨关节炎疼痛通常被描述为类似于牙痛。腕管综合征通常会引起一种如坐针毡的感觉。这种刺痛感通常发生在拇指、食指和中指，尤其是在晚上。手腕疼痛的确切位置也为症状背后的原因提供了线索。,1076.0
2026,我最近一直觉得很不舒服。我一直有严重的瘙痒、呕吐和疲劳。我的体重也减轻了，还发了高烧。我的皮肤变黄了，尿液变黑了。我还感到腹痛。,541.0
2027,呕吐、头痛、恶心、旋转、失去平衡、不稳定,0.0
2028,大多数人没有与扁平足相关的症状。但有些扁平足患者会感到脚痛，尤其是足跟或足弓部位。疼痛可能会随着活动而加重。脚踝内侧可能会出现肿胀。,381.0
2029,大多数肝肺综合征患者没有任何症状。如果出现症状，可能包括：呼吸急促，尤其是坐着或站着时。手指打结，指尖张开，变得比正常情况下更圆。皮肤下的血管破裂（蜘蛛血管瘤）嘴唇和皮肤发蓝（发绀）。当肺部及其周围的血管变宽（扩张）时，会引起肝肺综合征，这会影响从肺部进入血流的氧气量。导致这种异常的原因尚不清楚，也不清楚为什么一些肝病患者会发展成肝肺综合征，而另一些人则不会。梅奥诊所工作人员梅奥诊所的工作人员在梅奥诊所进行肝肺综合征护理,469.0
2030,背痛、虚弱、胸闷、头晕,186.0
2031,我最近感觉很虚弱，很冷，咳嗽不止。我咳嗽的时候胸口很疼，而且我的心砰砰直跳。我一直在咳出锈褐色的粘液。,766.0
2032,呕吐、疲劳、焦虑、出汗、头痛、恶心、模糊和视觉障碍、过度发热、干涩和抽搐、口齿不清、易怒、心悸,504.0
2033,我很难集中注意力，我的情绪到处都是。我的头脑有时会感到阴云密布，即使是简单的任务也很难完成。,284.0
2034,skin_rash，high_fever，起泡，红色ore_around_nose，黄色crust_ooze,515.0
2035,肌肉无力、脖子僵硬、关节肿胀、动作不稳、行走疼痛,72.0
2036,我发烧了，背部很疼。我的胳膊和腋下也有皮疹。我的眼球后部很疼。我担心我的健康。,275.0
2037,我的肌肉很弱，脖子也很紧。我的关节肿了，动起来很疼。,72.0
2038,skin_rash、joint_pain、skin_peeling、silver_like_dusting、small_dents_in_nail、炎症指甲,822.0
2039,发冷、呕吐、发烧、出汗、头痛、恶心、腹泻、肌肉酸痛,596.0
2040,发冷、呕吐、疲劳、体重减轻、咳嗽、高烧、呼吸困难、出汗、食欲不振、轻度发烧、黄热病、淋巴结肿大、不适、痰、胸闷、瘀血,1019.0
2041,SARS通常以流感样体征和症状开始——发烧、发冷、肌肉酸痛、头痛，偶尔还会腹泻。大约一周后，体征和症状包括：100.5华氏度（38摄氏度）或更高的SARS发烧干咳呼吸急促,877.0
2042,疲劳、情绪波动、体重减轻、烦躁不安、出汗、腹泻、心率加快、体重过大、肌肉无力、易怒、月经异常,502.0
2043,胸闷、头晕、失去平衡、注意力不集中,501.0
2044,疲劳、咳嗽、高烧、呼吸困难、家族病史、粘液性脓毒症,149.0
2045,不费力的反流，通常在进食后10分钟内腹痛或反流缓解压力饱腹感口臭恶心无意减肥反刍综合征通常与干呕无关。,868.0
2046,持续发烧、发冷、疲劳、咳嗽、高烧、头痛、淋巴结肿大、不适、痰、喉咙刺激、眼睛发红、窦压、流鼻涕、充血、胸闷、嗅觉丧失、肌肉酸痛,234.0
2047,我的脖子和背部一直很疼。我还感到头晕和虚弱。,186.0
2048,疲劳、体重减轻、烦躁不安、嗜睡、视力模糊、肥胖、超重、食欲增加、多尿,285.0
2049,背痛、虚弱、胸闷、头晕、失去平衡,186.0
2050,skin_rash、pus_filled imples、blackheads、匆匆忙忙,7.0
2051,肺炎的体征和症状从轻微到严重不等，这取决于引起感染的细菌类型、年龄和整体健康状况等因素。轻微的体征和症状通常与感冒或流感相似，但持续时间更长。肺炎的体征和症状可能包括：呼吸或咳嗽时胸痛困惑或精神意识改变（65岁及以上的成年人）咳嗽，这可能会产生痰疲劳发烧、出汗和颤抖的寒战低于正常体温（65岁以上的成年人和免疫系统较弱的人）恶心，呕吐或腹泻呼吸急促新生儿和婴儿可能没有任何感染迹象。或者，他们可能会呕吐、发烧和咳嗽，表现出烦躁不安或疲倦，没有精力，或者呼吸和进食困难。何时去看医生如果你呼吸困难、胸痛、102华氏度（39摄氏度）或更高的持续发烧或持续咳嗽，尤其是咳嗽出脓液，请去看医生。尤其重要的是，这些高危人群要去看医生：65岁以上的成年人，2岁以下有体征和症状的儿童，有潜在健康状况或免疫系统减弱的人，接受化疗或服用抑制免疫系统的药物的人，肺炎很快就会成为危及生命的疾病。,766.0
2052,寒战、疲劳、咳嗽、高热、呼吸困难、出汗、不适、痰、胸闷、快速心率、锈蚀痰,766.0
2053,muscle_wasting、patches_in_throat、high_fever、extra_marital_contacts,27.0
2054,持续发烧、发冷、疲劳、咳嗽、高烧、头痛、淋巴结肿大、不适、痰、喉咙刺激、眼睛发红、窦压、流鼻涕、充血、胸闷、嗅觉丧失、肌肉酸痛,234.0
2055,胸闷、头晕、失去平衡、注意力不集中,501.0
2056,瘙痒、结节性皮肤破裂、血栓斑块,394.0
2057,症状各不相同，取决于饮食失调的类型。神经性厌食症、神经性贪食症和暴饮症是最常见的饮食障碍。其他饮食障碍包括反刍障碍和回避型/限制性食物摄入障碍。神经性厌食症神经性厌食（an-o-REK-see-uh）——通常简称为厌食症——是一种潜在的危及生命的进食障碍，其特征是体重异常低、对体重增加的强烈恐惧以及对体重或形状的扭曲感知。厌食症患者竭尽全力控制自己的体重和体型，这往往会严重干扰他们的健康和生活活动。当你患有厌食症时，你会过度限制热量或使用其他方法来减肥，如过度运动、使用泻药或减肥辅助剂，或饭后呕吐。努力减肥，即使体重不足，也会导致严重的健康问题，有时甚至到致命的自我饥饿的地步。神经性贪食症神经性贪食症——通常被称为贪食症——是一种严重的、可能危及生命的饮食障碍。当你患有贪食症时，你会有暴饮和净化的症状，包括对饮食缺乏控制。许多贪食症患者也会限制白天的饮食，这往往会导致更多的暴饮和净化。在这些情况下，你通常会在短时间内吃大量的食物，然后试图以不健康的方式去除多余的卡路里。由于内疚、羞耻和对过量饮食导致体重增加的强烈恐惧，你可能会强迫呕吐，或者运动过多，或者使用其他方法，如泻药，来去除热量。如果你患有贪食症，你可能会专注于自己的体重和体型，并可能会因为自己的缺陷而对自己进行严厉的评判。你可能体重正常，甚至有点超重。暴饮性饮食障碍当你患有暴饮性进食障碍时，你经常吃太多的食物（暴饮），并感觉对自己的饮食缺乏控制。即使你不饿，你也可能吃得很快或吃得比预期的多，甚至在你饱得不舒服很久之后你也可能继续吃。在狂饮之后，你可能会对自己的行为和所吃的食物量感到内疚、厌恶或羞愧。但你不会像贪食症或厌食症患者那样，试图通过过度锻炼或净化来弥补这种行为。尴尬会导致独自吃饭来掩饰你的暴饮。新一轮的狂饮通常每周至少发生一次。你可能体重正常，超重或肥胖。反刍障碍反刍障碍是指进食后反复、持续地反胃，但它不是由某种疾病或其他饮食障碍引起的，如厌食症、贪食症或暴饮症。食物被带回嘴里时不会恶心或呕吐，而且反流可能不是故意的。有时，反流的食物会被重新吸入并重新吞咽或吐出。如果食物被吐出，或者为了防止这种行为而吃得明显少，这种疾病可能会导致营养不良。反刍障碍的发生可能在婴儿期或智力残疾的人中更常见。回避/限制性食物摄入障碍这种障碍的特点是由于你对饮食不感兴趣而无法满足你的最低每日营养需求；避免食用具有某些感官特征的食物，如颜色、质地、气味或味道；或者你担心吃东西的后果，比如害怕窒息。食物并不是因为害怕体重增加而避免的。这种疾病会导致儿童时期体重显著下降或无法增加体重，以及可能导致健康问题的营养缺乏。,327.0
2058,呕吐、日晒、脱水、腹泻,402.0
2059,寒战、疲劳、咳嗽、高热、呼吸困难、出汗、不适、痰、胸闷、快速心率、锈蚀痰,766.0
2060,我一直在经历颈部疼痛、手臂和腿部无力以及持续咳嗽。我也有平衡问题和头晕。,186.0
2061,疲劳、体重、手冷、脚痛、情绪波动、嗜睡、头晕、面部浮肿、眼睛肿胀、甲状腺肿大、脚痛、嗜睡、抑郁、易怒、月经异常,511.0
2062,疲劳、体重减轻、烦躁不安、血糖水平不规则、视力模糊、过度肥胖、食欲增加、多尿,285.0
2063,皮肤瘙痒、发冷、关节疼痛、呕吐、疲劳、高烧、头痛、恶心、食欲不振、疼痛、背痛、不适、肌肉疼痛、红色斑点过多,275.0
2064,起初，缺铁性贫血可能非常轻微，以至于不被注意到。但随着身体越来越缺乏铁和贫血的恶化，症状和体征也会加剧。缺铁性贫血的体征和症状可能包括：极度疲劳虚弱皮肤苍白胸痛、心跳加快或呼吸急促头痛、头晕或头晕手脚冰冷舌头发炎或酸痛指甲脆对非营养物质的异常渴望，如冰、泥土或淀粉食欲差，尤其是婴幼儿缺铁性贫血,537.0
2065,我一直在经历关节疼痛和皮肤剥落。我很担心我的身体怎么了。,822.0
2066,胃、酸度、溃疡、舌头、呕吐、咳嗽、胸部疼痛,412.0
2067,酸度、消化不良、头痛、视力模糊、过度疲劳、脖子僵硬、抑郁、易怒、视觉障碍,630.0
2068,我最近一直感到虚弱和疼痛，关节又肿又僵硬。四处走动很困难，走路尤其痛苦。,72.0
2069,我的背部和颈部一直很疼。我还咳嗽产生痰，感到虚弱和头晕。,186.0
2070,我的肌肉很弱，脖子也很紧。我的关节肿胀，很难在不僵硬的情况下活动。走路也很困难。,72.0
2071,muscle_wasting、patches_in_throat、high_fever、extra_marital_contacts,27.0
2072,关节疼痛、呕吐、疲劳、皮肤发黄、恶心、食欲不振、腹部疼痛、黄色,467.0
